Exhibit No.,Exhibit
10.1,"Abbott Laboratories 2009 Incentive Stock Program, as amended and restated."
12,Statement re: Computation of Ratio of Earnings to Fixed Charges.
31.1,Certification of Chief Executive Officer Required by Rule 13a-14(a) (17 CFR 240.13a-14(a)).
31.2,Certification of Chief Financial Officer Required by Rule 13a-14(a) (17 CFR 240.13a-14(a)).
Exhibits 32.1 and 32.2 are furnished herewith and should not be deemed to be “filed” under the Securities Exchange Act of 1934.,
32.1,"Certification of Chief Executive Officer Pursuant to 18 U.S.C. Section 1350, as Adopted Pursuant to Section 906 of the Sarbanes-Oxley Act of 2002."
32.2,"Certification of Chief Financial Officer Pursuant to 18 U.S.C. Section 1350, as Adopted Pursuant to Section 906 of the Sarbanes-Oxley Act of 2002."
101,"The following financial statements and notes from the Abbott Laboratories Quarterly Report on Form 10-Q for the quarter ended March 31, 2014, formatted in XBRL: (i) Condensed Consolidated Statement of Earnings; (ii) Condensed Consolidated Statement of Comprehensive Income; (iii) Condensed Consolidated Balance Sheet; (iv) Condensed Consolidated Statement of Cash Flows; and (v) the notes to the condensed consolidated financial statements."