"(dollars in millions)",,"Fair Value - Assets","Fair Value - Assets","Fair Value - Assets",,"Fair Value - Liabilities","Fair Value - Liabilities","Fair Value - Liabilities"
,,Sept. 30 2011,Dec. 31 2010,Balance Sheet Caption,,Sept. 30 2011,Dec. 31 2010,Balance Sheet Caption
"Interest rate swaps designated as fair value hedges",,616,138,"Deferred income taxes and other assets",,,"36","Post-employment obligations, deferred income taxes and other long-term liabilities"
"Interest rate swaps designated as fair value hedges",,,"8","Prepaid expenses, deferred income taxes, and other receivables",,,,
"Foreign currency forward exchange contracts — Hedging instruments",,19,16,"Prepaid expenses, deferred income taxes, and other receivables",,6,10,"Other accrued liabilities"
"Foreign currency forward exchange contracts — Others not designated as hedges",,60,109,"Prepaid expenses, deferred income taxes, and other receivables",,72,120,"Other accrued liabilities"
"Debt designated as a hedge of net investment in a foreign subsidiary",,,,,"690","650","Short-term borrowings"
,,695,271,,,,768,816
